{
  "$schema": "https://json-schema.org/draft/2020-12/schema",
  "$id": "https://bookmarks.getbible.net/schema/api/topics.schema.json",
  "title": "v1/topics.json",
  "type": "object",
  "additionalProperties": false,
  "required": [
    "schema_version",
    "catalog_version",
    "checksum",
    "topics"
  ],
  "properties": {
    "schema_version": {
      "const": 1
    },
    "catalog_version": {
      "type": "integer",
      "minimum": 1
    },
    "checksum": {
      "type": "string",
      "pattern": "^[0-9a-f]{64}$"
    },
    "topics": {
      "type": "array",
      "items": {
        "type": "object",
        "additionalProperties": false,
        "required": [
          "id",
          "name",
          "color",
          "aliases",
          "default",
          "verses"
        ],
        "properties": {
          "id": {
            "type": "string",
            "pattern": "^[a-z0-9]+(?:-[a-z0-9]+)*$",
            "maxLength": 80
          },
          "name": {
            "type": "string",
            "pattern": "^[A-Za-z0-9][A-Za-z0-9 &'():?-]*[A-Za-z0-9)]$",
            "maxLength": 80
          },
          "color": {
            "type": "string",
            "pattern": "^#[0-9a-f]{6}$"
          },
          "aliases": {
            "type": "array",
            "maxItems": 20,
            "uniqueItems": true,
            "items": {
              "type": "string",
              "pattern": "^[A-Za-z0-9][A-Za-z0-9 &'():?-]*[A-Za-z0-9)]$",
              "maxLength": 80
            }
          },
          "default": {
            "type": "boolean"
          },
          "verses": {
            "type": "integer",
            "minimum": 0
          }
        }
      }
    }
  }
}
